{
  "schema_version": "request-dry-run-summary-input.v0",
  "request_id": "DOT-1355",
  "scope": "agentmesh:app:request-dry-run-summary",
  "target_app": "request-dry-run-summary",
  "markdown": "---\ntitle: \"Add a deterministic request dry-run summary adapter app\"\nready_for_multica: true\nstatus: ready\nproject_key: agentmesh-private\nissue_type: AFK\nrequest_kind: app\nsource_prd: \"4_Project/OSS/agentmesh-private/Requests/App/2026-08-05-add-a-deterministic-request-dry-run-summary-adapter-app.md\"\nsource_design: 4_Project/OSS/agentmesh-private/Docs/agentmesh-request-operations-v1.md\nsource_roadmap: 4_Project/OSS/agentmesh-private/ROADMAP.md\nsequence_index: 1\nsequence_total: 1\nblocked_by: []\nunblocks: []\n---\n# Add a deterministic request dry-run summary adapter app\n\n## What to build\nBuild the deterministic preview app.\n\n## Acceptance criteria\n- Preview is stable.\n"
}
