{
  "schema_version": "request-dry-run-summary-input.v0",
  "request_id": "DOT-1355",
  "scope": "agentmesh:app:request-dry-run-summary",
  "target_app": "request-dry-run-summary",
  "markdown": "---\nrequest_kind: app\nissue_type: AFK\nstatus: ready\nproject_key: agentmesh-private\nsource_prd: Requests/App/request-dry-run-summary.md\nsource_design: Docs/agentmesh-request-operations-v1.md\nsource_roadmap: ROADMAP.md\nsequence_index: 1\nsequence_total: 1\nblocked_by: []\nunblocks: []\n---\n# Missing title\n\n## What to build\nBuild it.\n"
}
